{
  "bindingId": "tsmm.binding.dcas.v1",
  "label": "TSMM to DCAS binding",
  "description": "Maps DTG Conformance & Assurance System (DCAS) concepts into TSMM abstractions for assurance, evidence, and evaluation workflows.",
  "targetEcosystem": "DCAS",
  "version": "1.0.0",
  "sources": [
    "docs/crosswalks/dcas-crosswalk.md",
    "docs/bindings/dcas-binding.md"
  ],
  "mappings": [
    {
      "externalConcept": "DCAS Control Objective",
      "tsmmType": "Policy",
      "bindingStrength": "approximate",
      "description": "Normative expectation used to govern evaluation and downstream trust effects."
    },
    {
      "externalConcept": "DCAS Evidence Bundle",
      "tsmmType": "EvidenceBundle",
      "bindingStrength": "exact",
      "description": "Structured evidence set used to substantiate conformance and assurance posture.",
      "relatedDocs": [
        "docs/patterns/assurance-evidence-pattern.md"
      ]
    },
    {
      "externalConcept": "DCAS Assessment",
      "tsmmType": "Assessment",
      "bindingStrength": "exact",
      "description": "Formal evaluation activity over declared controls and observed evidence."
    },
    {
      "externalConcept": "DCAS Assurance Profile",
      "tsmmType": "AssuranceProfile",
      "bindingStrength": "exact",
      "description": "Profile defining rigor, evidence depth, and assessment expectations."
    },
    {
      "externalConcept": "Relying verifier or assessor",
      "tsmmType": "Verifier",
      "bindingStrength": "approximate",
      "description": "Actor evaluating whether evidence and controls are sufficient in context."
    }
  ],
  "notes": [
    "DCAS is assurance-heavy and maps most directly into the policy, evidence, assessment, and profile surfaces of TSMM.",
    "This binding is semantic and explanatory. It does not replace DCAS terminology or normative requirements."
  ],
  "metadata": {
    "maintainer": "maintainers",
    "status": "draft"
  },
  "bindingContract": {
    "sourceModel": "TSMM",
    "targetSystem": "DCAS",
    "bindingVersion": "1.1.0",
    "guarantees": [
      {
        "name": "assurance-alignment",
        "status": "supported",
        "description": "DCAS evidence, assessment, and assurance concepts map directly into TSMM assurance surfaces."
      },
      {
        "name": "evaluation-traceability",
        "status": "supported",
        "description": "Assessment activities and evidence bundles can be represented as traceable TSMM objects."
      },
      {
        "name": "control-catalog-preservation",
        "status": "partial",
        "description": "Control objectives map to TSMM policy abstractions, but fine-grained control taxonomies remain ecosystem-specific."
      }
    ],
    "limitations": [
      {
        "name": "assessment procedure specificity",
        "impact": "TSMM does not substitute for DCAS assessment method definitions or scoring logic.",
        "mitigation": "Pair TSMM with DCAS-specific procedures when conducting formal evaluation."
      }
    ],
    "behavioralExpectations": [
      {
        "behavior": "assurance evaluation",
        "expectation": "Assessments preserve linkage among control objectives, evidence, and resulting trust decisions.",
        "sourceRefs": [
          "docs/bindings/dcas-binding.md",
          "docs/patterns/assurance-evidence-pattern.md"
        ]
      },
      {
        "behavior": "profile selection",
        "expectation": "Assurance profiles remain explicit inputs to decisioning rather than background documentation.",
        "sourceRefs": [
          "docs/crosswalks/dcas-crosswalk.md"
        ]
      }
    ],
    "constraintSetRef": "bindings/dcas/constraints.json"
  }
}
